{
  "schema_version": 2,
  "submission_id": "bbbbbbbb-bbbb-4bbb-8bbb-bbbbbbbbbbbb",
  "client_submission_id": "aaaaaaaa-aaaa-4aaa-8aaa-aaaaaaaaaaaa",
  "project_key": "mun-bon",
  "calendar_system": "rid-irrigation-v1",
  "week_key": "2026-R01",
  "week_date": "2025-11-01",
  "submitted_at": "2025-11-01T01:02:03Z",
  "submitted_by": "operator-1",
  "supersedes_submission_id": null,
  "request_sha256": "aaaaaaaaaaaaaaaaaaaaaaaaaaaaaaaaaaaaaaaaaaaaaaaaaaaaaaaaaaaaaaaa",
  "levels": [
    { "section_id": "01-01-01-03", "zone_id": "01-01", "planning_depth_mm": 1, "source_kind": "zone_default", "source_area_id": "01-01" },
    { "section_id": "01-01-01-04", "zone_id": "01-01", "planning_depth_mm": 1, "source_kind": "zone_default", "source_area_id": "01-01" },
    { "section_id": "01-01-01-05", "zone_id": "01-01", "planning_depth_mm": 1, "source_kind": "zone_default", "source_area_id": "01-01" },
    { "section_id": "01-01-01-06", "zone_id": "01-01", "planning_depth_mm": 1, "source_kind": "zone_default", "source_area_id": "01-01" },
    { "section_id": "01-01-01-07", "zone_id": "01-01", "planning_depth_mm": 1, "source_kind": "zone_default", "source_area_id": "01-01" },
    { "section_id": "01-02-01-08", "zone_id": "01-02", "planning_depth_mm": 2, "source_kind": "zone_default", "source_area_id": "01-02" },
    { "section_id": "01-02-01-09", "zone_id": "01-02", "planning_depth_mm": 2, "source_kind": "zone_default", "source_area_id": "01-02" },
    { "section_id": "01-02-01-10", "zone_id": "01-02", "planning_depth_mm": 2, "source_kind": "zone_default", "source_area_id": "01-02" },
    { "section_id": "01-02-01-11", "zone_id": "01-02", "planning_depth_mm": 2, "source_kind": "zone_default", "source_area_id": "01-02" },
    { "section_id": "01-02-01-12", "zone_id": "01-02", "planning_depth_mm": 2, "source_kind": "zone_default", "source_area_id": "01-02" },
    { "section_id": "01-02-01-13", "zone_id": "01-02", "planning_depth_mm": 2, "source_kind": "zone_default", "source_area_id": "01-02" },
    { "section_id": "01-02-01-14", "zone_id": "01-02", "planning_depth_mm": 2, "source_kind": "zone_default", "source_area_id": "01-02" },
    { "section_id": "01-03-01-15", "zone_id": "01-03", "planning_depth_mm": 3, "source_kind": "zone_default", "source_area_id": "01-03" },
    { "section_id": "01-03-01-16", "zone_id": "01-03", "planning_depth_mm": 3, "source_kind": "zone_default", "source_area_id": "01-03" },
    { "section_id": "01-03-01-17", "zone_id": "01-03", "planning_depth_mm": 3, "source_kind": "zone_default", "source_area_id": "01-03" },
    { "section_id": "01-03-01-18", "zone_id": "01-03", "planning_depth_mm": 3, "source_kind": "zone_default", "source_area_id": "01-03" },
    { "section_id": "01-03-01-19", "zone_id": "01-03", "planning_depth_mm": 3, "source_kind": "zone_default", "source_area_id": "01-03" },
    { "section_id": "01-04-01-20", "zone_id": "01-04", "planning_depth_mm": 4, "source_kind": "zone_default", "source_area_id": "01-04" },
    { "section_id": "01-04-01-21", "zone_id": "01-04", "planning_depth_mm": 4, "source_kind": "zone_default", "source_area_id": "01-04" },
    { "section_id": "01-04-01-22", "zone_id": "01-04", "planning_depth_mm": 4, "source_kind": "zone_default", "source_area_id": "01-04" },
    { "section_id": "01-04-01-23", "zone_id": "01-04", "planning_depth_mm": 4, "source_kind": "zone_default", "source_area_id": "01-04" },
    { "section_id": "01-04-01-24", "zone_id": "01-04", "planning_depth_mm": 4, "source_kind": "zone_default", "source_area_id": "01-04" },
    { "section_id": "01-04-01-25", "zone_id": "01-04", "planning_depth_mm": 4, "source_kind": "zone_default", "source_area_id": "01-04" },
    { "section_id": "01-04-01-26", "zone_id": "01-04", "planning_depth_mm": 4, "source_kind": "zone_default", "source_area_id": "01-04" },
    { "section_id": "01-05-01-27", "zone_id": "01-05", "planning_depth_mm": 5, "source_kind": "zone_default", "source_area_id": "01-05" },
    { "section_id": "01-05-01-28", "zone_id": "01-05", "planning_depth_mm": 5, "source_kind": "zone_default", "source_area_id": "01-05" },
    { "section_id": "01-05-01-29", "zone_id": "01-05", "planning_depth_mm": 5, "source_kind": "zone_default", "source_area_id": "01-05" },
    { "section_id": "01-05-01-30", "zone_id": "01-05", "planning_depth_mm": 5, "source_kind": "zone_default", "source_area_id": "01-05" },
    { "section_id": "01-05-01-31", "zone_id": "01-05", "planning_depth_mm": 5, "source_kind": "zone_default", "source_area_id": "01-05" },
    { "section_id": "01-05-01-32", "zone_id": "01-05", "planning_depth_mm": 5, "source_kind": "zone_default", "source_area_id": "01-05" },
    { "section_id": "01-05-01-33", "zone_id": "01-05", "planning_depth_mm": 5, "source_kind": "zone_default", "source_area_id": "01-05" },
    { "section_id": "01-05-01-34", "zone_id": "01-05", "planning_depth_mm": 5, "source_kind": "zone_default", "source_area_id": "01-05" },
    { "section_id": "01-06-01-35", "zone_id": "01-06", "planning_depth_mm": 6, "source_kind": "zone_default", "source_area_id": "01-06" },
    { "section_id": "01-06-01-36", "zone_id": "01-06", "planning_depth_mm": 6, "source_kind": "zone_default", "source_area_id": "01-06" },
    { "section_id": "01-06-01-37", "zone_id": "01-06", "planning_depth_mm": 6, "source_kind": "zone_default", "source_area_id": "01-06" },
    { "section_id": "01-06-01-38", "zone_id": "01-06", "planning_depth_mm": 6, "source_kind": "zone_default", "source_area_id": "01-06" },
    { "section_id": "01-06-01-39", "zone_id": "01-06", "planning_depth_mm": 6, "source_kind": "zone_default", "source_area_id": "01-06" },
    { "section_id": "01-06-01-40", "zone_id": "01-06", "planning_depth_mm": 6, "source_kind": "zone_default", "source_area_id": "01-06" },
    { "section_id": "01-06-01-41", "zone_id": "01-06", "planning_depth_mm": 6, "source_kind": "zone_default", "source_area_id": "01-06" },
    { "section_id": "01-06-01-42", "zone_id": "01-06", "planning_depth_mm": 6, "source_kind": "zone_default", "source_area_id": "01-06" },
    { "section_id": "01-06-01-43", "zone_id": "01-06", "planning_depth_mm": 6, "source_kind": "zone_default", "source_area_id": "01-06" }
  ]
}
